{
  "version": "1",
  "workoutFile": "workouts/2-4_Easy_Run_4_Miles.json",
  "timestamp": "2025-09-02T12:12:37.359Z",
  "exercises": {
    "easy-run": {
      "name": "Easy Run",
      "sets": [
        {
          "distanceMiles": 4,
          "timeSeconds": 1912,
          "rpe": 4
        }
      ]
    }
  }
}