{
  "version": "1",
  "workoutFile": "workouts/2-3_Upper_Body_Strength_Mobility.md",
  "timestamp": "2025-08-26T12:29:56.653Z",
  "exercises": {
    "neutral-grip-flat-bench-press": {
      "name": "Neutral-Grip Flat Bench Press",
      "sets": [
        {
          "weight": 47.5,
          "multiplier": 2,
          "reps": 6
        },
        {
          "weight": 47.5,
          "multiplier": 2,
          "reps": 6
        },
        {
          "weight": 47.5,
          "multiplier": 2,
          "reps": 5
        },
        {
          "weight": 47.5,
          "multiplier": 2,
          "reps": 3
        }
      ]
    },
    "one-arm-dumbbell-row": {
      "name": "One-Arm Dumbbell Row",
      "sets": [
        {
          "weight": 37.5,
          "multiplier": 1,
          "reps": 8
        },
        {
          "weight": 37.5,
          "multiplier": 1,
          "reps": 10
        },
        {
          "weight": 37.5,
          "multiplier": 1,
          "reps": 10
        },
        {
          "weight": 37.5,
          "multiplier": 1,
          "reps": 10
        }
      ]
    },
    "seated-arnold-press": {
      "name": "Seated Arnold Press",
      "sets": [
        {
          "weight": 27.5,
          "multiplier": 2,
          "reps": 8
        },
        {
          "weight": 27.5,
          "multiplier": 2,
          "reps": 8
        },
        {
          "weight": 27.5,
          "multiplier": 2,
          "reps": 8
        }
      ]
    },
    "biceps-curl": {
      "name": "Biceps Curl",
      "sets": [
        {
          "weight": 27.5,
          "multiplier": 2,
          "reps": 12
        },
        {
          "weight": 27.5,
          "multiplier": 2,
          "reps": 12
        },
        {
          "weight": 27.5,
          "multiplier": 2,
          "reps": 12
        }
      ]
    },
    "overhead-dumbbell-triceps-extension": {
      "name": "Overhead Dumbbell Triceps Extension",
      "sets": [
        {
          "weight": 37.5,
          "reps": 12
        },
        {
          "weight": 37.5,
          "reps": 10
        },
        {
          "weight": 37.5,
          "reps": 8
        }
      ]
    },
    "plank-shoulder-tap": {
      "name": "Plank Shoulder Tap",
      "sets": [
        {
          "reps": 20
        },
        {
          "reps": 20
        }
      ]
    }
  }
}
