{
  "version": "1",
  "workoutFile": "workouts/2-3_Easy_Run_4_Miles.md",
  "timestamp": "2025-08-26T11:42:53.750Z",
  "exercises": {
    "easy-run": {
      "name": "Easy Run",
      "sets": [
        {
          "distanceMiles": 4,
          "timeSeconds": 1834,
          "rpe": 4.5
        }
      ]
    }
  }
}
