{
  "version": "1",
  "workoutFile": "workouts/2-3_Lower_Body_Strength_Mobility.md",
  "timestamp": "2025-08-27T12:41:33.664Z",
  "exercises": {
    "goblet-squat": {
      "name": "Goblet Squat",
      "sets": [
        {
          "weight": 57.5,
          "reps": 8
        },
        {
          "weight": 57.5,
          "reps": 8
        },
        {
          "weight": 57.5,
          "reps": 8
        },
        {
          "weight": 57.5,
          "reps": 8
        }
      ]
    },
    "dumbbell-romanian-deadlift": {
      "name": "Dumbbell Romanian Deadlift",
      "sets": [
        {
          "weight": 57.5,
          "multiplier": 2,
          "reps": 10
        },
        {
          "weight": 57.5,
          "multiplier": 2,
          "reps": 8
        },
        {
          "weight": 57.5,
          "multiplier": 2,
          "reps": 8
        },
        {
          "weight": 57.5,
          "multiplier": 2,
          "reps": 8
        }
      ]
    },
    "bulgarian-split-squat": {
      "name": "Bulgarian Split Squat",
      "sets": [
        {
          "weight": 27.5,
          "multiplier": 2,
          "reps": 10
        },
        {
          "weight": 27.5,
          "multiplier": 2,
          "reps": 10
        },
        {
          "weight": 27.5,
          "multiplier": 2,
          "reps": 10
        }
      ]
    },
    "standing-calf-raise": {
      "name": "Standing Calf Raise",
      "sets": [
        {
          "weight": 27.5,
          "multiplier": 2,
          "reps": 15
        },
        {
          "weight": 27.5,
          "multiplier": 2,
          "reps": 15
        },
        {
          "weight": 27.5,
          "multiplier": 2,
          "reps": 15
        }
      ]
    },
    "side-plank": {
      "name": "Side Plank",
      "sets": [
        {
          "timeSeconds": 45
        },
        {
          "timeSeconds": 45
        }
      ]
    }
  }
}