{
  "version": "1",
  "workoutFile": "workouts/2-4_Upper_Body_Strength_Mobility.json",
  "timestamp": "2025-09-01T13:14:19.865Z",
  "exercises": {
    "neutral-grip-flat-bench-press": {
      "name": "Neutral-Grip Flat Bench Press",
      "sets": [
        {
          "weight": 45,
          "multiplier": 2,
          "reps": 6,
          "rpe": 6.5
        },
        {
          "weight": 45,
          "multiplier": 2,
          "reps": 6,
          "rpe": 6.5
        },
        {
          "weight": 45,
          "multiplier": 2,
          "reps": 6,
          "rpe": 6.5
        }
      ]
    },
    "one-arm-dumbbell-row": {
      "name": "One-Arm Dumbbell Row",
      "sets": [
        {
          "weight": 35,
          "reps": 10,
          "rpe": 6.5
        },
        {
          "weight": 35,
          "reps": 10,
          "rpe": 6.5
        },
        {
          "weight": 35,
          "reps": 10,
          "rpe": 6.5
        }
      ]
    },
    "seated-arnold-press": {
      "name": "Seated Arnold Press",
      "sets": [
        {
          "weight": 25,
          "multiplier": 2,
          "reps": 6,
          "rpe": 7
        },
        {
          "weight": 25,
          "multiplier": 2,
          "reps": 6,
          "rpe": 7
        },
        {
          "weight": 25,
          "multiplier": 2,
          "reps": 6,
          "rpe": 7
        }
      ]
    },
    "biceps-curl": {
      "name": "Biceps Curl",
      "sets": [
        {
          "weight": 25,
          "multiplier": 2,
          "reps": 10,
          "rpe": 6.5
        },
        {
          "weight": 25,
          "multiplier": 2,
          "reps": 10,
          "rpe": 6.5
        }
      ]
    },
    "overhead-dumbbell-triceps-extension": {
      "name": "Overhead Dumbbell Triceps Extension",
      "sets": [
        {
          "weight": 35,
          "reps": 10,
          "rpe": 6.5
        },
        {
          "weight": 35,
          "reps": 10,
          "rpe": 6.5
        }
      ]
    },
    "plank-shoulder-tap": {
      "name": "Plank Shoulder Tap",
      "sets": [
        {
          "reps": 16
        },
        {
          "reps": 16
        }
      ]
    }
  }
}