{
  "version": "1",
  "workoutFile": "workouts/2-2_Upper_Body_Strength_Mobility.md",
  "timestamp": "2025-08-22T12:00:00Z",
  "date": "2025-08-22",
  "block": 2,
  "week": 2,
  "title": "Upper Body Strength & Mobility",
  "notes": "Template example. Replace workoutFile and sets with your actual session.",
  "device": {
    "agent": "pages-logger",
    "platform": "iPadOS"
  },
  "exercises": {
    "Flat Dumbbell Bench Press": {
      "name": "Flat Dumbbell Bench Press",
      "sets": [
        { "weight": "25 x2", "reps": 10, "rpe": 7.5 },
        { "weight": "30 x2", "reps": 8, "rpe": 8 }
      ]
    },
    "Plank": {
      "name": "Plank",
      "sets": [
        { "timeSeconds": 45, "notes": "steady breathing" }
      ]
    }
  }
}
